{
  "$schema": "https://json-schema.org/draft/2020-12/schema",
  "$id": "https://github.com/ali-demirbas/claude-lifecycle/templates/journey.schema.json",
  "title": "Journey",
  "description": "CRM-agnostic journey definition: entry conditions, steps, branches and exits, independent of any marketing tool's own schema.",
  "type": "object",
  "required": ["id", "name", "pattern", "stage", "priority", "data_tier", "dqs", "objective", "trigger", "audience", "exit", "steps", "kpis"],
  "additionalProperties": false,
  "$defs": {
    "channel": {
      "type": "string",
      "enum": ["email", "push", "sms", "in_app", "whatsapp"],
      "description": "The single source of truth for the channel vocabulary in this schema — referenced by both constraints.allowed_channels and steps[].channel so the two can never drift apart the way a hand-duplicated enum eventually would (the exact bug class already found and fixed in knowledge/channels/*.md's ceilings elsewhere in this repo)."
    },
    "flowNode": {
      "type": "object",
      "required": ["kind"],
      "additionalProperties": false,
      "description": "One node in the journey's explicit branch tree (top-level `flow`). Its shape is deliberately identical to the canvas node-tree already consumed by templates/canvas.html and scripts/build_canvas.py, so `flow` doubles as the canvas `root` with no transform — see scripts/journey_render.py (Mermaid + step table) and scripts/build_canvas.py (--from-journeys).",
      "properties": {
        "kind": {
          "type": "string",
          "enum": ["entry", "decision", "message", "wait", "exit"],
          "description": "entry = trigger root (exactly one, the tree root); decision = branch point (its children carry edge labels); message = a send (carries channel); wait = a delay node; exit = a terminal leaf (carries exit good|bad)."
        },
        "tag": { "type": "string", "description": "Header tag shown on the card, e.g. 'Gün 0 · Email → Admin' or 'Yol Ayrımı'" },
        "title": { "type": "string", "minLength": 1, "description": "The node's bold title line; also the label used for this node in the generated Mermaid diagram" },
        "channel": { "$ref": "#/$defs/channel" },
        "rows": {
          "type": "array",
          "items": {
            "type": "object",
            "required": ["html"],
            "additionalProperties": false,
            "properties": {
              "icon": { "type": "string", "description": "Icon key from templates/canvas.html's ICONS map; an unknown key renders blank, so it is advisory only" },
              "html": { "type": "string", "minLength": 1, "description": "Row body — the one field authored as HTML ({{var}} tokens are highlighted); every other text field is escaped" }
            }
          }
        },
        "extra": {
          "type": "object",
          "additionalProperties": { "type": "string" },
          "description": "Optional key→value detail shown under a collapsible 'Detaylar' toggle on the card"
        },
        "exit": {
          "type": "string",
          "enum": ["good", "bad"],
          "description": "Terminal outcome class — required in practice on kind=exit nodes (good = success exit, bad = lost/expired)"
        },
        "children": {
          "type": "array",
          "items": { "$ref": "#/$defs/flowChild" },
          "description": "Ordered outgoing edges; for a decision node each child's `label` is its edge label (e.g. Evet/Hayır)"
        }
      }
    },
    "flowChild": {
      "type": "object",
      "required": ["node"],
      "additionalProperties": false,
      "description": "One outgoing edge: an optional edge label plus the child node it points to",
      "properties": {
        "label": { "type": ["string", "null"], "description": "Edge label (branch condition outcome, e.g. 'Evet'/'Hayır'); null for an unlabeled linear edge" },
        "node": { "$ref": "#/$defs/flowNode" }
      }
    }
  },
  "properties": {
    "version": {
      "type": "string",
      "pattern": "^[0-9]+\\.[0-9]+\\.[0-9]+$",
      "description": "SemVer of this journey definition; bump on every change so live CRM builds can be diffed against the source"
    },
    "constraints": {
      "type": "object",
      "additionalProperties": false,
      "description": "Machine-checkable red lines, embedded from the brand config at generation time so scripts/validate_output.py can enforce them without context",
      "properties": {
        "max_discount_pct": { "type": ["number", "null"], "minimum": 0, "maximum": 100 },
        "allowed_channels": {
          "type": "array",
          "items": { "$ref": "#/$defs/channel" }
        }
      }
    },
    "id": {
      "type": "string",
      "pattern": "^[a-z0-9]+(-[a-z0-9]+)*-[0-9]{2}$",
      "description": "Format: <sector>-<pattern>-<nn>, e.g. ecom-abandoned-cart-01"
    },
    "name": { "type": "string", "minLength": 1, "maxLength": 80 },
    "pattern": {
      "type": "string",
      "minLength": 1,
      "description": "Slug of a file in knowledge/journey-patterns/, e.g. abandoned-cart. JSON Schema can't check filesystem existence — scripts/validate_output.py check_journey cross-references this against the actual knowledge/journey-patterns/<pattern>.md files, the same class of check scripts/validate.sh already runs for industries/pattern_priorities."
    },
    "vertical": {
      "type": "string",
      "description": "For multi-vertical brands only: which of the brand config's `verticals` entries this journey belongs to. Absent for single-industry brands. Was previously only carried in the human-facing journey-doc.md/journey-portfolio.md 'Vertical' column with no machine-facing counterpart — a downstream consumer working from JSON alone (lifecycle-export, an eval script) had no reliable way to group or filter journeys by vertical."
    },
    "stage": {
      "type": "string",
      "enum": ["acquisition", "activation", "engagement", "revenue", "retention", "winback"]
    },
    "priority": { "type": "string", "enum": ["P0", "P1", "P2"] },
    "data_tier": { "type": "string", "enum": ["T1", "T2", "T3"] },
    "dqs": { "type": "integer", "minimum": 0, "maximum": 100 },
    "depth_class": {
      "type": "string",
      "enum": ["simple", "standard", "branched"],
      "description": "Mirrors templates/journey-doc.md's header field and the vocabulary every knowledge/journey-patterns/*.md Depth scaling table already uses — was displayed to the user in the markdown doc but had no machine-facing counterpart before this field existed."
    },
    "objective": { "type": "string", "minLength": 1 },
    "trigger": {
      "type": "object",
      "required": ["type", "value"],
      "additionalProperties": false,
      "properties": {
        "type": { "type": "string", "enum": ["event", "time", "segment_entry"], "description": "Pattern-level trigger_type values 'segment' and 'absence' both instantiate as segment_entry (the segment is what expresses the absence condition)" },
        "value": { "type": "string", "minLength": 1, "description": "Event name, cron/schedule, or segment id" },
        "entry_conditions": { "type": "array", "items": { "type": "string" } },
        "reentry_policy": { "type": "string" }
      }
    },
    "audience": {
      "type": "object",
      "required": ["include"],
      "additionalProperties": false,
      "properties": {
        "include": { "type": "string", "minLength": 1 },
        "exclude": { "type": "array", "items": { "type": "string" } },
        "estimated_volume": { "type": ["integer", "null"], "minimum": 0 }
      }
    },
    "exit": {
      "type": "object",
      "required": ["success_event"],
      "additionalProperties": false,
      "properties": {
        "success_event": { "type": "string", "minLength": 1 },
        "success_window_days": { "type": "integer", "minimum": 1 },
        "other_exits": { "type": "array", "items": { "type": "string" } }
      }
    },
    "steps": {
      "type": "array",
      "minItems": 1,
      "items": {
        "type": "object",
        "required": ["index", "wait", "channel", "intent"],
        "additionalProperties": false,
        "properties": {
          "index": { "type": "integer", "minimum": 1 },
          "wait": {
            "type": "string",
            "pattern": "^P(?!$)(?:\\d+W|(\\d+D)?(T(?=\\d)(\\d+H)?(\\d+M)?(\\d+S)?)?)$",
            "description": "Relative wait, e.g. PT1H, P1D, P1W (ISO 8601 duration — the week designator is mutually exclusive with D/T per the standard, hence the separate alternative). Mirrors scripts/validate_output.py's ISO_WAIT regex — kept in both places deliberately: the schema makes the constraint visible to any external tool reading this file directly, the Python check stays the always-on backstop for when the jsonschema library isn't installed (check_journey falls back to a structural check that skips patterns entirely)."
          },
          "channel": { "$ref": "#/$defs/channel" },
          "intent": { "type": "string", "minLength": 1 },
          "branch_condition": { "type": ["string", "null"], "description": "Condition to enter this step; null for linear steps" },
          "copy_ref": { "type": "string", "description": "Block id in the copy output, e.g. step-2" }
        }
      }
    },
    "kpis": {
      "type": "array",
      "minItems": 1,
      "items": {
        "type": "object",
        "required": ["name", "type", "definition"],
        "additionalProperties": false,
        "properties": {
          "name": { "type": "string", "minLength": 1 },
          "type": { "type": "string", "enum": ["primary", "secondary", "guardrail"] },
          "definition": { "type": "string", "minLength": 1 },
          "target": { "type": ["string", "null"] }
        }
      }
    },
    "experiment": {
      "type": "object",
      "additionalProperties": false,
      "properties": {
        "holdout_pct": { "type": "number", "minimum": 0, "maximum": 50 },
        "ab_test": { "type": ["string", "null"] }
      }
    },
    "data_gaps": {
      "type": "array",
      "items": { "type": "string" },
      "description": "Missing events/attributes that would improve this journey"
    },
    "flow": {
      "$ref": "#/$defs/flowNode",
      "description": "OPTIONAL explicit branch tree — the authoritative BRANCH structure of this journey. When present, scripts/journey_render.py generates the journey-doc §8 Mermaid diagram from it (branch-faithful, not a linear approximation) and scripts/build_canvas.py uses it directly as the canvas node-tree. The flat `steps` array above stays the source for the §5 step table (per-step wait/intent/channel/branch_condition/copy_ref linkage). Absent on pre-existing journeys, which keep hand-authored mechanical sections and a flat linear canvas fallback — hence optional."
    }
  }
}
